{
  "schema_version": "0.1.0",
  "command": "scan",
  "status": "complete",
  "snapshot_id": "sha256:b80362059d472cc93f3156927a55902c90dd813d0a582ff68ba1250f2a5faf6e",
  "artifact_id": "scan:547a9045f574763a4f4b3b7940ef3f02c9fd8bc1f002d4a9e76f1c621ed8b6d1",
  "data": {
    "manifest": {
      "schema_version": "0.1.0",
      "command": "inventory",
      "status": "complete",
      "snapshot_id": "sha256:b80362059d472cc93f3156927a55902c90dd813d0a582ff68ba1250f2a5faf6e",
      "data": {
        "tool_version": "0.0.1",
        "analysis_level": "inventory",
        "snapshot": {
          "mode": "git-commit",
          "object_format": "sha1",
          "commit_sha": "d6d0cca39e606452643fa5fdacd90c94dc17b373",
          "tree_sha": "6697fcd44a18c75553d218b97bb0cae72583fa02"
        },
        "scope": {
          "include": [
            "."
          ],
          "exclude": []
        },
        "files": [
          {
            "path": "format.ts",
            "object_id": "ff2d89818a143c72522c33755c241afaf9a5fd51",
            "mode": "100644",
            "object_type": "blob",
            "size_bytes": 78,
            "kind": "source",
            "test_named": false,
            "status": "inventoried",
            "reason": null
          },
          {
            "path": "index.test.ts",
            "object_id": "d54726e584d16d91c78900e97a713a59d421afc8",
            "mode": "100644",
            "object_type": "blob",
            "size_bytes": 157,
            "kind": "source",
            "test_named": true,
            "status": "inventoried",
            "reason": null
          },
          {
            "path": "index.ts",
            "object_id": "d5bdb5559f1de9698f67d42d1fa831ffab8021fc",
            "mode": "100644",
            "object_type": "blob",
            "size_bytes": 116,
            "kind": "source",
            "test_named": false,
            "status": "inventoried",
            "reason": null
          },
          {
            "path": "package.json",
            "object_id": "044a86418b6b42ac0d8726344c8f855729fb8725",
            "mode": "100644",
            "object_type": "blob",
            "size_bytes": 71,
            "kind": "config",
            "test_named": false,
            "status": "inventoried",
            "reason": null
          },
          {
            "path": "tsconfig.json",
            "object_id": "65846902bb54c495d552bb2adcaa409b06dd599f",
            "mode": "100644",
            "object_type": "blob",
            "size_bytes": 93,
            "kind": "config",
            "test_named": false,
            "status": "inventoried",
            "reason": null
          }
        ]
      },
      "diagnostics": [],
      "coverage": {
        "tracked_entries": 5,
        "inventoried_files": 5,
        "excluded_entries": 0,
        "inventoried_bytes": 515,
        "parsed_files": 0,
        "semantic_analysis": "not-run"
      }
    },
    "adapter": {
      "name": "typescript",
      "version": "m1.1",
      "compiler_version": "5.9.3",
      "resolution_mode": "source-only",
      "full_typecheck": false,
      "external_types_loaded": false,
      "max_file_bytes": 2097152,
      "max_total_bytes": 33554432,
      "max_source_files": 1000,
      "max_projects": 128
    },
    "projects": [
      {
        "id": "project:f928d59026e5d4054680121854ffc29e89c839fa0c0a04bc80da6b63d33f9a55",
        "config_path": "tsconfig.json",
        "config_sha256": "39d99c25f52c4ad519ce4d5383dd870a83ca2d161912e4b860f62622e1fc3533",
        "references": [],
        "source_files": [
          "format.ts",
          "index.test.ts",
          "index.ts"
        ],
        "selected_files": [
          "format.ts",
          "index.test.ts",
          "index.ts"
        ],
        "status": "loaded",
        "options": {
          "base_url": null,
          "paths": {},
          "module": "NodeNext",
          "module_resolution": "Bundler",
          "target": "ES2023",
          "jsx": "Preserve",
          "types": []
        }
      }
    ],
    "reads": [
      {
        "path": "format.ts",
        "blob_sha": "ff2d89818a143c72522c33755c241afaf9a5fd51",
        "content_sha256": "6e9bc8cdbbd515f50513279a939c5e736dcdf97ddf68275e330a11d025ee3fd6",
        "size_bytes": 78,
        "purpose": "source"
      },
      {
        "path": "index.test.ts",
        "blob_sha": "d54726e584d16d91c78900e97a713a59d421afc8",
        "content_sha256": "e9b9c0cd74535bb4bb9fa3314af403bbf5360293ef4e147bfd0a8c9880e79f7a",
        "size_bytes": 157,
        "purpose": "source"
      },
      {
        "path": "index.ts",
        "blob_sha": "d5bdb5559f1de9698f67d42d1fa831ffab8021fc",
        "content_sha256": "e4aa5405dc3a5fcf7e4f04ecf02a969aa374a0d7ac17fe192134579ed6a7d6dc",
        "size_bytes": 116,
        "purpose": "source"
      },
      {
        "path": "tsconfig.json",
        "blob_sha": "65846902bb54c495d552bb2adcaa409b06dd599f",
        "content_sha256": "39d99c25f52c4ad519ce4d5383dd870a83ca2d161912e4b860f62622e1fc3533",
        "size_bytes": 93,
        "purpose": "config"
      }
    ],
    "files": [
      {
        "id": "file:35b9210dc114ec5535fc53adeb798c277ce9d21cdf6a4040adecf4854bf10f80",
        "path": "format.ts",
        "blob_sha": "ff2d89818a143c72522c33755c241afaf9a5fd51",
        "content_sha256": "6e9bc8cdbbd515f50513279a939c5e736dcdf97ddf68275e330a11d025ee3fd6",
        "size_bytes": 78,
        "role": "selected",
        "status": "parsed",
        "project_ids": [
          "project:f928d59026e5d4054680121854ffc29e89c839fa0c0a04bc80da6b63d33f9a55"
        ]
      },
      {
        "id": "file:e1f51eeef4adb6bc82f13dd5dc3762d0636ec5a09c72077973174c0391b5822c",
        "path": "index.test.ts",
        "blob_sha": "d54726e584d16d91c78900e97a713a59d421afc8",
        "content_sha256": "e9b9c0cd74535bb4bb9fa3314af403bbf5360293ef4e147bfd0a8c9880e79f7a",
        "size_bytes": 157,
        "role": "selected",
        "status": "parsed",
        "project_ids": [
          "project:f928d59026e5d4054680121854ffc29e89c839fa0c0a04bc80da6b63d33f9a55"
        ]
      },
      {
        "id": "file:10dbd683d03ce03a87a16103ebba98d57a5271b011e13f161665ced51e057cf6",
        "path": "index.ts",
        "blob_sha": "d5bdb5559f1de9698f67d42d1fa831ffab8021fc",
        "content_sha256": "e4aa5405dc3a5fcf7e4f04ecf02a969aa374a0d7ac17fe192134579ed6a7d6dc",
        "size_bytes": 116,
        "role": "selected",
        "status": "parsed",
        "project_ids": [
          "project:f928d59026e5d4054680121854ffc29e89c839fa0c0a04bc80da6b63d33f9a55"
        ]
      }
    ],
    "symbols": [
      {
        "id": "symbol:0edc7ee7c6877be6e7b9b0f49835db8a77b697634cde022256616ac428402242",
        "file_id": "file:e1f51eeef4adb6bc82f13dd5dc3762d0636ec5a09c72077973174c0391b5822c",
        "project_id": "project:f928d59026e5d4054680121854ffc29e89c839fa0c0a04bc80da6b63d33f9a55",
        "name": "example",
        "kind": "variable",
        "evidence_id": "evidence:4c88a0710c97f30ec79f23a83ef91e1b3c6ec406b3ab4ee3b8cc7c181a5dd779"
      },
      {
        "id": "symbol:4b22b9d60eda7809d9164e67003f7f445452098534a51eab174a9f2cf54a3d04",
        "file_id": "file:10dbd683d03ce03a87a16103ebba98d57a5271b011e13f161665ced51e057cf6",
        "project_id": "project:f928d59026e5d4054680121854ffc29e89c839fa0c0a04bc80da6b63d33f9a55",
        "name": "welcome",
        "kind": "function",
        "evidence_id": "evidence:bd59b349cde3554b1ce74b6867117747c417812bac1682a700b28090a44e4737"
      },
      {
        "id": "symbol:bb1db5d24dde139210c3f785a4e73fa2fe123856927191893427fce1b94fbade",
        "file_id": "file:35b9210dc114ec5535fc53adeb798c277ce9d21cdf6a4040adecf4854bf10f80",
        "project_id": "project:f928d59026e5d4054680121854ffc29e89c839fa0c0a04bc80da6b63d33f9a55",
        "name": "name",
        "kind": "parameter",
        "evidence_id": "evidence:eb3acb657a44c804059bf63ae7dd8593cdcd797d55546d9bf38d19ae415ef83f"
      },
      {
        "id": "symbol:c9c935dbf13d2bf4c2434e8df260de742a3cd9e1d02f4d30724aa7e6cd9ce236",
        "file_id": "file:35b9210dc114ec5535fc53adeb798c277ce9d21cdf6a4040adecf4854bf10f80",
        "project_id": "project:f928d59026e5d4054680121854ffc29e89c839fa0c0a04bc80da6b63d33f9a55",
        "name": "greeting",
        "kind": "function",
        "evidence_id": "evidence:2aa9f9bd256df68bc0fcec15074c5150702b28081c6f8fd0f2c1c96935867482"
      },
      {
        "id": "symbol:f70cd7d69ff2ad88cdb5bc0146ef76853672c5a9278f1266d6f3fbd556f32fb4",
        "file_id": "file:10dbd683d03ce03a87a16103ebba98d57a5271b011e13f161665ced51e057cf6",
        "project_id": "project:f928d59026e5d4054680121854ffc29e89c839fa0c0a04bc80da6b63d33f9a55",
        "name": "name",
        "kind": "parameter",
        "evidence_id": "evidence:1404cfc8ef5061c8fb6014d3bb256e47152e64aae7839cc5d84efc25a3baf68d"
      }
    ],
    "evidence": [
      {
        "id": "evidence:1404cfc8ef5061c8fb6014d3bb256e47152e64aae7839cc5d84efc25a3baf68d",
        "snapshot_id": "sha256:b80362059d472cc93f3156927a55902c90dd813d0a582ff68ba1250f2a5faf6e",
        "file_id": "file:10dbd683d03ce03a87a16103ebba98d57a5271b011e13f161665ced51e057cf6",
        "project_id": "project:f928d59026e5d4054680121854ffc29e89c839fa0c0a04bc80da6b63d33f9a55",
        "blob_sha": "d5bdb5559f1de9698f67d42d1fa831ffab8021fc",
        "content_sha256": "e4aa5405dc3a5fcf7e4f04ecf02a969aa374a0d7ac17fe192134579ed6a7d6dc",
        "start_byte": 65,
        "end_byte": 77,
        "start_line": 3,
        "start_column": 25,
        "end_line": 3,
        "end_column": 37,
        "span_sha256": "3fe91fb41414bb1a9acb3f10c945cf313455b9fc30923e4c3c22b83b17b4c5c5",
        "method": "typescript-syntax"
      },
      {
        "id": "evidence:2464606649da9424714be4b8744ec35344efa9c4e72d33b960dc374c844671ad",
        "snapshot_id": "sha256:b80362059d472cc93f3156927a55902c90dd813d0a582ff68ba1250f2a5faf6e",